Quote,Interpretation
"""Compare yourself to others only in a noble and just manner - lest you create envy in others""","To compare oneself to others is a dangerous game unless tempered by nobility and justice. The mind naturally weighs itself against others, but the motive must be for self-betterment, not superiority. When comparison stems from ego or insecurity, it becomes a seed of envy in both self and others. But when it arises from a desire to grow with humility, it mirrors a form of respect — not competition. The wise compare to learn, not to boast."
"""Pay your dues and be kind to other's requests but never depart from moral reason, not necessarily your reason""","Obedience and kindness are not inherently virtuous unless anchored in a deeper moral compass. The quote distinguishes between personal reasoning and moral reasoning — the latter transcends ego and cultural bias. One may fulfill duties and accommodate others, yet without wisdom, these acts become servitude, not virtue. Always weigh your actions against a universal ethic, even if it contradicts your personal rationale."
"""Never fully trust someone without noble values""","Trust, though essential to connection, becomes treacherous when bestowed on those lacking an ethical foundation. Noble values act as internal governors — without them, a person becomes unpredictable in crisis. This quote reminds us to discern character before confiding, for words may be sweet, but actions during hardship reveal true allegiance. Trust is not a gift; it is an earned privilege."
"""Cherished are those well versed in communication, but better gifted are those blessed with a heart""","While eloquence may win applause, it is heart that builds bridges of the soul. Words are tools, but without compassion behind them, they become hollow instruments of persuasion. True influence arises not from clever speech, but from authentic feeling. This quote uplifts those whose warmth can be felt even in silence — who speak from conscience, not just from tongue."
"""Heed wisdoms of old, to console wisdoms of the present""","The present is often too loud to hear its own heart. Ancient wisdoms, born of trials and contemplation, offer a lantern through today's fog. To dismiss them is to restart the same fire with wet wood. Yet this is not blind adherence to the past — it is an invitation to dialogue between eras. Only when we listen backwards can we move forwards with grace."
"""Love comes and goes many times over but a soulmate may only come once""","The heart is capable of loving many, yet the soul aligns with few. This quote warns against confusing infatuation with destiny. A soulmate is not a constant companion, but a cosmic echo — a recognition that transcends time. Most people love to fill voids, but once in a rare while, love arrives to complete a purpose. Be vigilant — for such moments may never repeat."
"""Always look a gift vehicle under the bonnet""","A gift, especially when unexpected, may conceal intent or defect. This quote is a metaphor for discernment: accept kindness, but never suspend critical thought. Behind every gesture lies a motive or a mechanism. The wise examine before embracing, not out of suspicion, but out of self-respect. Gratitude and caution are not mutually exclusive."
"""Be attentive to what is said about you as it reflects your own nature""","Reputation is not mere gossip — it is a mirror distorted by social perception. While not always accurate, what is said often stems from patterns we leave behind. To be attentive is not to be obsessed, but to glean insight. If multiple voices echo the same concern, it may reflect blind spots in character. Growth begins with listening, even when it stings."
"""Genuine altruism asks for compassion to others en parallel to compassion to self""","True altruism is not self-sacrifice unto depletion, but balance. To give to others without honoring your own being is martyrdom, not virtue. This quote insists that self-compassion is not selfishness; it is the root of sustainable giving. The most noble acts arise from wholeness, not from brokenness disguised as generosity."
"""Pure altruism necessitates a sacrifice of the self for the sake of another""","This is the rarer form of altruism — the kind that costs you something irretrievable. It transcends ethics and enters the realm of spiritual offering. It is not sustainable as a lifestyle, but it is sacred when the moment calls. The self, when given fully in service to another’s need, becomes immortalized not in reward, but in meaning. Few are called to it — fewer still answer."
"""Forgive but forget not for the sake of wisdom only""","To forgive is noble, but to forget is often mistaken as weakness — unless one forgets selectively for the sake of retaining wisdom. The mind, like a garden, must pull out the weeds of bitterness but keep the roots of remembrance to prevent repetition. This quote reminds us that forgetting is not erasure, but refinement of memory toward growth."
"""Pursue your passion and not the money, and if a compromise may be found, so be it""","Passion fuels life’s purpose in a way that money never can. To pursue wealth alone is to chase a mirage, but to follow one’s passion is to light a fire that can warm others as well. If money joins the journey, it’s a blessing — but if it replaces the path, it becomes a curse."
"""Remember kind and bad words but dwell on only the kind ones""","Memory is a double-edged tool. To remember both kindness and cruelty gives depth, but to ruminate on the harsh leaves one corroded. This quote invites discernment — recall all, but nourish only what elevates the soul."
"""Believe in something, stand it up to reason, and let bliss prosper""","Belief without reason is zealotry, and reason without belief is cold. When we stand firm in a conviction but test it against logic, we give ourselves the chance to evolve — and in that evolution, find peace. Let bliss be earned, not blind."
"""Learn from fear when need be, and overcome it next time""","Fear is both a teacher and a tyrant. If we listen to it, we may learn — if we bow to it, we may stall. This quote recognizes fear not as an enemy but as a compass, meant to be understood then overcome, step by step."
"""If you seek something but cannot find then try asking instead""","The act of asking is one of humility. It acknowledges our limits and opens the door to shared knowledge. In seeking help, we give others the gift of being needed — and in return, we learn that connection solves more than solitude ever could."
"""If you fail to see an afterlife, or better times to be, reason quick for you are in the wrong""","If your worldview holds no space for the afterlife, or for hope, you may be misaligned with the very structure of human resilience. This quote urges us to reframe our despair and find the light in a broader horizon — one that extends beyond the now."
"""When stuck at sea, do not underestimate the gift of the gab""","At sea, language becomes survival. This line reminds us that communication, charm, and even humor are tools — not for manipulation, but for navigation. In rough waters, sometimes a well-spoken word is worth more than a well-built sail."
"""Do not openly disbelieve the improbable, assign it a probability instead""","Dismissing the improbable is a form of arrogance. Assigning probability is a form of wisdom. This quote teaches scientific humility — the idea that uncertainty is not ignorance, but a spectrum of possibility where even the absurd has a place."
"""If your enemies give you a hard time it may be plausible to passively approach them, time and time again - tact is the key""","A passive approach to enemies does not mean weakness, but patience in disguise. Tact is not appeasement — it is strategy. This quote speaks to the long game of human relations: that silence, timing, and subtlety often outplay brute force."
"""Be tolerant to those that choose to harm themselves believing otherwise as long as they are out of sight""","Kindness is not weakness but deliberate strength. This quote — 'Be tolerant to those that choose to harm themselves believing otherwise as long as they are out of sight' — invites us to reconsider not only what it states, but the nature of how we live around it. It speaks to the invisible threads of ethics, identity, and interpersonal reflection. Taken to heart, it offers a moment of rare internal recalibration: a signal to think differently about what we’ve accepted, ignored, or feared."
"""Be open to new ideas, but do not openly embrace anything without some skepticism""","The human psyche wrestles with duality. This quote — 'Be open to new ideas, but do not openly embrace anything without some skepticism' — invites us to reconsider not only what it states, but the nature of how we live around it. It speaks to the invisible threads of ethics, identity, and interpersonal reflection. Taken to heart, it offers a moment of rare internal recalibration: a signal to think differently about what we’ve accepted, ignored, or feared."
"""Always pay your dues, ahead of time preferably, because rewards are often associated""","The eternal battle between impulse and reason. This quote — 'Always pay your dues, ahead of time preferably, because rewards are often associated' — invites us to reconsider not only what it states, but the nature of how we live around it. It speaks to the invisible threads of ethics, identity, and interpersonal reflection. Taken to heart, it offers a moment of rare internal recalibration: a signal to think differently about what we’ve accepted, ignored, or feared."
"""Get in the habit of doing some good deeds every once in a while at least - good happens""","The eternal battle between impulse and reason. This quote — 'Get in the habit of doing some good deeds every once in a while at least - good happens' — invites us to reconsider not only what it states, but the nature of how we live around it. It speaks to the invisible threads of ethics, identity, and interpersonal reflection. Taken to heart, it offers a moment of rare internal recalibration: a signal to think differently about what we’ve accepted, ignored, or feared."
"""If you aim for perfection in this life mayhap it is only attained at full essence in the next""","True morality is often inconvenient. This quote — 'If you aim for perfection in this life mayhap it is only attained at full essence in the next' — invites us to reconsider not only what it states, but the nature of how we live around it. It speaks to the invisible threads of ethics, identity, and interpersonal reflection. Taken to heart, it offers a moment of rare internal recalibration: a signal to think differently about what we’ve accepted, ignored, or feared."
"""Respect your elders and love thy parents no matter what as these are traits of nobility""","The human psyche wrestles with duality. This quote — 'Respect your elders and love thy parents no matter what as these are traits of nobility' — invites us to reconsider not only what it states, but the nature of how we live around it. It speaks to the invisible threads of ethics, identity, and interpersonal reflection. Taken to heart, it offers a moment of rare internal recalibration: a signal to think differently about what we’ve accepted, ignored, or feared."
"""Holding dear to some celebrative days are a must for a sense of identity and integrity""","True change begins with inward honesty. This quote — 'Holding dear to some celebrative days are a must for a sense of identity and integrity' — invites us to reconsider not only what it states, but the nature of how we live around it. It speaks to the invisible threads of ethics, identity, and interpersonal reflection. Taken to heart, it offers a moment of rare internal recalibration: a signal to think differently about what we’ve accepted, ignored, or feared."
"""Destined are we, but it is up to you for what in spirit""","The human psyche wrestles with duality. This quote — 'Destined are we, but it is up to you for what in spirit' — invites us to reconsider not only what it states, but the nature of how we live around it. It speaks to the invisible threads of ethics, identity, and interpersonal reflection. Taken to heart, it offers a moment of rare internal recalibration: a signal to think differently about what we’ve accepted, ignored, or feared."
"""Utilize the failures of your life for stories of grandeur when possible""","True morality is often inconvenient. This quote — 'Utilize the failures of your life for stories of grandeur when possible' — invites us to reconsider not only what it states, but the nature of how we live around it. It speaks to the invisible threads of ethics, identity, and interpersonal reflection. Taken to heart, it offers a moment of rare internal recalibration: a signal to think differently about what we’ve accepted, ignored, or feared."
"""Patience is a virtue that is best met when justified""","Silence sometimes speaks more than declarations. This quote — 'Patience is a virtue that is best met when justified' — invites us to reconsider not only what it states, but the nature of how we live around it. It speaks to the invisible threads of ethics, identity, and interpersonal reflection. Taken to heart, it offers a moment of rare internal recalibration: a signal to think differently about what we’ve accepted, ignored, or feared."
"""Without expression of wants and needs in a manner befitting thou shall not receive""","What we avoid often defines us. This quote — 'Without expression of wants and needs in a manner befitting thou shall not receive' — invites us to reconsider not only what it states, but the nature of how we live around it. It speaks to the invisible threads of ethics, identity, and interpersonal reflection. Taken to heart, it offers a moment of rare internal recalibration: a signal to think differently about what we’ve accepted, ignored, or feared."
"""Happiness arises when one frees him/herself from worries - worry not about imperfections and instead capitalize on the true beauty of them""","Authenticity demands sacrifice. This quote — 'Happiness arises when one frees him/herself from worries - worry not about imperfections and instead capitalize on the true beauty of them' — invites us to reconsider not only what it states, but the nature of how we live around it. It speaks to the invisible threads of ethics, identity, and interpersonal reflection. Taken to heart, it offers a moment of rare internal recalibration: a signal to think differently about what we’ve accepted, ignored, or feared."
"""Be not embarrassed as to whom you are, but be wary as to who you disclose yourself to""","Silence sometimes speaks more than declarations. This quote — 'Be not embarrassed as to whom you are, but be wary as to who you disclose yourself to' — invites us to reconsider not only what it states, but the nature of how we live around it. It speaks to the invisible threads of ethics, identity, and interpersonal reflection. Taken to heart, it offers a moment of rare internal recalibration: a signal to think differently about what we’ve accepted, ignored, or feared."
"""There is no shame in living a life of plenty, however not helping others when in position - major shame""","The soul matures through tension and paradox. This quote — 'There is no shame in living a life of plenty, however not helping others when in position - major shame' — invites us to reconsider not only what it states, but the nature of how we live around it. It speaks to the invisible threads of ethics, identity, and interpersonal reflection. Taken to heart, it offers a moment of rare internal recalibration: a signal to think differently about what we’ve accepted, ignored, or feared."
"""Respect education, but remember also to respect hard labour""","Kindness is not weakness but deliberate strength. This quote — 'Respect education, but remember also to respect hard labour' — invites us to reconsider not only what it states, but the nature of how we live around it. It speaks to the invisible threads of ethics, identity, and interpersonal reflection. Taken to heart, it offers a moment of rare internal recalibration: a signal to think differently about what we’ve accepted, ignored, or feared."
"""Remember compliments, forget insults but only if untrue and not harmful""","True morality is often inconvenient. This quote — 'Remember compliments, forget insults but only if untrue and not harmful' — invites us to reconsider not only what it states, but the nature of how we live around it. It speaks to the invisible threads of ethics, identity, and interpersonal reflection. Taken to heart, it offers a moment of rare internal recalibration: a signal to think differently about what we’ve accepted, ignored, or feared."
"""All forms of government work, but to the right people""","What we avoid often defines us. This quote — 'All forms of government work, but to the right people' — invites us to reconsider not only what it states, but the nature of how we live around it. It speaks to the invisible threads of ethics, identity, and interpersonal reflection. Taken to heart, it offers a moment of rare internal recalibration: a signal to think differently about what we’ve accepted, ignored, or feared."
"""A belief in myths is not altogether foolish if it impacts your next life to be""","The human psyche wrestles with duality. This quote — 'A belief in myths is not altogether foolish if it impacts your next life to be' — invites us to reconsider not only what it states, but the nature of how we live around it. It speaks to the invisible threads of ethics, identity, and interpersonal reflection. Taken to heart, it offers a moment of rare internal recalibration: a signal to think differently about what we’ve accepted, ignored, or feared."
"""Being original is not always seen as favourable""","The human psyche wrestles with duality. This quote — 'Being original is not always seen as favourable' — invites us to reconsider not only what it states, but the nature of how we live around it. It speaks to the invisible threads of ethics, identity, and interpersonal reflection. Taken to heart, it offers a moment of rare internal recalibration: a signal to think differently about what we’ve accepted, ignored, or feared."
"""Being humble enhances the appreciation for the finer things - all in time""","Wisdom often hides within contradiction. This quote — 'Being humble enhances the appreciation for the finer things - all in time' — invites us to reconsider not only what it states, but the nature of how we live around it. It speaks to the invisible threads of ethics, identity, and interpersonal reflection. Taken to heart, it offers a moment of rare internal recalibration: a signal to think differently about what we’ve accepted, ignored, or feared."
"""Never undermine someone on lesse you do no harm""","The eternal battle between impulse and reason. This quote — 'Never undermine someone on lesse you do no harm' — invites us to reconsider not only what it states, but the nature of how we live around it. It speaks to the invisible threads of ethics, identity, and interpersonal reflection. Taken to heart, it offers a moment of rare internal recalibration: a signal to think differently about what we’ve accepted, ignored, or feared."
"""Believe in yourself, but if unable to do so at times then rely on others""","Insight blooms in the soil of discomfort. This quote — 'Believe in yourself, but if unable to do so at times then rely on others' — invites us to reconsider not only what it states, but the nature of how we live around it. It speaks to the invisible threads of ethics, identity, and interpersonal reflection. Taken to heart, it offers a moment of rare internal recalibration: a signal to think differently about what we’ve accepted, ignored, or feared."
"""If anything can go wrong rest assured it shall not always or ever be so""","True morality is often inconvenient. This quote — 'If anything can go wrong rest assured it shall not always or ever be so' — invites us to reconsider not only what it states, but the nature of how we live around it. It speaks to the invisible threads of ethics, identity, and interpersonal reflection. Taken to heart, it offers a moment of rare internal recalibration: a signal to think differently about what we’ve accepted, ignored, or feared."
"""You are beautiful no matter how ugly you are labelled - it is all relative to different people""","Silence sometimes speaks more than declarations. This quote — 'You are beautiful no matter how ugly you are labelled - it is all relative to different people' — invites us to reconsider not only what it states, but the nature of how we live around it. It speaks to the invisible threads of ethics, identity, and interpersonal reflection. Taken to heart, it offers a moment of rare internal recalibration: a signal to think differently about what we’ve accepted, ignored, or feared."
"""In a universe with infinites, no matter what kind, mayhap every religion needs respect""","The eternal battle between impulse and reason. This quote — 'In a universe with infinites, no matter what kind, mayhap every religion needs respect' — invites us to reconsider not only what it states, but the nature of how we live around it. It speaks to the invisible threads of ethics, identity, and interpersonal reflection. Taken to heart, it offers a moment of rare internal recalibration: a signal to think differently about what we’ve accepted, ignored, or feared."
"""Slavery is purely ethical and proper if served as an optional part of a sentence""","Kindness is not weakness but deliberate strength. This quote — 'Slavery is purely ethical and proper if served as an optional part of a sentence' — invites us to reconsider not only what it states, but the nature of how we live around it. It speaks to the invisible threads of ethics, identity, and interpersonal reflection. Taken to heart, it offers a moment of rare internal recalibration: a signal to think differently about what we’ve accepted, ignored, or feared."
"""Obesity is not a sin but it is a wrong to oneself only if it make'th ye unhappy""","True change begins with inward honesty. This quote — 'Obesity is not a sin but it is a wrong to oneself only if it make'th ye unhappy' — invites us to reconsider not only what it states, but the nature of how we live around it. It speaks to the invisible threads of ethics, identity, and interpersonal reflection. Taken to heart, it offers a moment of rare internal recalibration: a signal to think differently about what we’ve accepted, ignored, or feared."
"""Pets are like children, that is, raise them in negligence and dumb they may be""","What we avoid often defines us. This quote — 'Pets are like children, that is, raise them in negligence and dumb they may be' — invites us to reconsider not only what it states, but the nature of how we live around it. It speaks to the invisible threads of ethics, identity, and interpersonal reflection. Taken to heart, it offers a moment of rare internal recalibration: a signal to think differently about what we’ve accepted, ignored, or feared."
"""Inter-stellar travel if proved possible would not necessarily be fun and games""","The human psyche wrestles with duality. This quote — 'Inter-stellar travel if proved possible would not necessarily be fun and games' — invites us to reconsider not only what it states, but the nature of how we live around it. It speaks to the invisible threads of ethics, identity, and interpersonal reflection. Taken to heart, it offers a moment of rare internal recalibration: a signal to think differently about what we’ve accepted, ignored, or feared."
"""Persistence is not always a good choice but it builds character""","Silence sometimes speaks more than declarations. This quote — 'Persistence is not always a good choice but it builds character' — invites us to reconsider not only what it states, but the nature of how we live around it. It speaks to the invisible threads of ethics, identity, and interpersonal reflection. Taken to heart, it offers a moment of rare internal recalibration: a signal to think differently about what we’ve accepted, ignored, or feared."
"""Good friends ‘may' think alike""","Authenticity demands sacrifice. This quote — 'Good friends ‘may' think alike' — invites us to reconsider not only what it states, but the nature of how we live around it. It speaks to the invisible threads of ethics, identity, and interpersonal reflection. Taken to heart, it offers a moment of rare internal recalibration: a signal to think differently about what we’ve accepted, ignored, or feared."
"""Be respectful to other's religions provided they are free from genuine evil""","Courage is not absence of fear but mastery of it. This quote — 'Be respectful to other's religions provided they are free from genuine evil' — invites us to reconsider not only what it states, but the nature of how we live around it. It speaks to the invisible threads of ethics, identity, and interpersonal reflection. Taken to heart, it offers a moment of rare internal recalibration: a signal to think differently about what we’ve accepted, ignored, or feared."
