Judging individuals entirely by appearances is utterly foolish,General,Neutral,Reflective,General,Anytime Wisdom,62,4.7,"If asked to do something foolish while drunk, please think things utterly through first; To live utterly honest one needs wisdom; The most perfect individuals are often unknown"
If megalomaniacs cause no harm they can be tolerable for entertainment reasons,General,Neutral,Reflective,General,Anytime Wisdom,78,5.9,Never undermine someone on lesse you do no harm; If your cause is fair then there is always a way; If someone claims they can do a job good then at least hear his/her reasons
Understand that even the nastiest of beings may have problems too,General,Neutral,Reflective,General,Anytime Wisdom,65,4.9,Wicked are wars that see human beings as chess pieces; If someone has been telling you his/her same problems for years then do something; What you do not understand about this world ‘may' be for your own safety
Metopomancy is wickedly immoral but ethically fun if done right,Humor,Neutral,Reflective,General,Lighthearted Moment,63,4.7,"Do the right thing not for deity alone but because it is right; It is always fun helping; All forms of government work, but to the right people"
Never pray to deities you do not fully understand unless in dire need,General,Neutral,Advisory,General,Anytime Wisdom,69,5.2,Pray like you mean it; Help others find love that need it so; Never fully trust someone without noble values
If getting ready for a long journey it makes good to prepare for the entertainment,General,Neutral,Reflective,General,Anytime Wisdom,82,6.2,Do the hobby that makes you most happy ultimately; If megalomaniacs cause no harm they can be tolerable for entertainment reasons; Skin colour makes no difference in heart
Be careful of brainwashing material on lesse certain it is of good nature,General,Neutral,Reflective,General,Anytime Wisdom,73,5.5,I do believe certain material possessions can be taken to the afterlife - why not?; Be careful before making an oath; Certain ideals are admirable by both evil and good alike
Inducing paranoia onto others is ethical only when well ministered,General,Neutral,Reflective,General,Anytime Wisdom,66,5,"Cheating with humour may be ethical; Paranoia is useless, it is called being cautious - learn to communicate and it goes away; Deranged is the person that cannot grasp the concept of ethical reason"
Think deeply what happens in a universe of infinites for when you perish,General,Neutral,Reflective,General,Anytime Wisdom,72,5.4,"In a universe with infinites, no matter what kind, mayhap every religion needs respect; If you think your experience is unique, think again, you are only human; Think deeply at who starts what wars in wars and for what cause"
With the technological means to communicate one should exploit them,General,Neutral,Reflective,General,Anytime Wisdom,67,5,"Paranoia is useless, it is called being cautious - learn to communicate and it goes away; Only use superstition as a means to inspire positively the self - nothing else; Good timing means absolutely everything when seeking perfection"
Wars occur over the tiniest conflicts,General,Neutral,Reflective,General,Anytime Wisdom,37,2.8,Think deeply at who starts what wars in wars and for what cause; It is awareness of the appreciation of the tiniest things in one that builds kinship; Well placed social catalysts can stop all wars
Don't believe mere hearsay with certainty,General,Neutral,Inspirational,General,Anytime Wisdom,41,3.1,Don't believe everything you read but don't mock just about everything either; Don't mess with what you don't quite understand; A lot of first impressions are made by irrational hearsay
It is not the search that thrills but the contentment in realisation,General,Neutral,Reflective,General,Anytime Wisdom,68,5.1,"Self contentment is greatly facilitated when adhering to noble virtues; Compare yourself to others only in a noble and just manner - lest you create envy in others; Pay your dues and be kind to other's requests but never depart from moral reason, not necessarily your reason"
If many individuals are calling and contacting you do not ignore them for they care,General,Neutral,Advisory,General,Anytime Wisdom,83,6.2,The most perfect individuals are often unknown; Even the most unlikely individuals do too have a story to tell; Some individuals will never experience pain or suffering - feel happy for them
It is easy to misinterpret someone's actions but easier still to fabricate new ones,General,Neutral,Reflective,General,Anytime Wisdom,83,6.2,You can't learn something new from just about anything; Death is no easy way out as the afterlife is never certain as such; Showing gratitude is conducive to further good actions
Keeping a diary provides a means to establish your identity and ensure longevity,Identity,Neutral,Reflective,General,Anytime Wisdom,80,6,"Grow to love your identity; Some memories are worth keeping best preserved; Typing life experiences is an easy ordeal, so why not keep a diary?"
"It is good to plan ahead in gist, even thousands of years at a glance",General,Neutral,Reflective,General,Anytime Wisdom,69,5.2,If someone has been telling you his/her same problems for years then do something; There is always a GREAT place for you in God's plan; Arational is he that does not think ahead
The power of faith does greater wonders when combined with reason,Faith,Neutral,Inspirational,Spirituality,Anytime Wisdom,65,4.9,Never give up the faith in good deeds; If God exists it does seem reasonable that it be ordering ‘all' to its greater glory; Learn what reason is
"Sometimes the mind serves as a better repository of history than paper, so use it",General,Neutral,Reflective,General,Anytime Wisdom,81,6.1,"Of course some genes may ‘seem' better, but what of mind, spirit, and soul; Deforming your innate character for the better will add a history of hurt; Horded is he/she that accumulates never to see the possessions in use again"
Appreciate good fortune when it comes to you,General,Neutral,Reflective,General,Anytime Wisdom,44,3.3,"You may not realise the face of poverty until it comes to you; We can appreciate food better if we know what we are eating; Do not let superstition control your life, instead learn to appreciate it"
Make good impressions on children because one day they will grow up with you in mind,General,Neutral,Reflective,General,Anytime Wisdom,84,6.3,Grow to love your identity; A lot of first impressions are made by irrational hearsay; If bored try to make it an objective to make someone happy and see how that feels
Battle for your humanitarian rights instead of letting others abuse you,General,Neutral,Reflective,General,Anytime Wisdom,71,5.3,"Discipline goes a long way towards a successful battle; Feminism is not about feminine superiority nor unfair rights, it is about reason; If you seek something but cannot find then try asking instead"
"Art is meant to be shown ultimately, so bear in mind of the target audience",General,Neutral,Reflective,General,Anytime Wisdom,75,5.6,Without friends nothing would ever get done - ultimately...; Do the hobby that makes you most happy ultimately; Art is an aphrodisiac of the soul
Certain problems affect people exceedingly differently,General,Neutral,Reflective,Human Nature,Anytime Wisdom,54,4.1,If someone has been telling you his/her same problems for years then do something; Long standing careers may cause one to think differently than norm; Everyone has problems; some just don't know what theirs is yet
"Not everyone is the same in work ethic, but we are similar enough to know a best way",General,Neutral,Reflective,Life Advice,Daily Motivation,84,6.3,"If you cannot work around the standard times, then make work suit your schedules; If you see a baker deplanate his dough with precision, then you know he loves his work; If your cause is fair then there is always a way"
A noble belief is usually for a good cause,General,Neutral,Reflective,General,Anytime Wisdom,42,3.2,"If your cause is fair then there is always a way; A belief in myths is not altogether foolish if it impacts your next life to be; Some news never make it to the public on the basis of hearsay, this with good cause"
If you plan a joke make sure you know the language first,General,Neutral,Witty,General,Daily Motivation,56,4.2,"To joke about suffering may be all in good fun but make sure a message is heard after; If someone gives you something precious of theirs make sure you know their reasons; When purchasing someone a gift book for someone, be sure you know them well"
Some of the best business ideas may spurt from universities,General,Neutral,Reflective,General,Anytime Wisdom,59,4.4,"Be open to new ideas, but do not openly embrace anything without some skepticism; It is best to live with some values than none; If one needs persuasion for good ideas or suggestion then the incumbent lacks reason"
Pray like you mean it,General,Neutral,Reflective,General,Anytime Wisdom,21,1.6,Perception may mean a lot; Just because you may know everything does not mean you can't listen; Just because someone doesn't work does not mean they are stupid
If you have not understood superstition first hand then you do not know the real world,General,Neutral,Advisory,General,Daily Motivation,86,6.5,We cannot solve the problems of others if we don't know the ‘real' person; Grown up fairy tales can be understood on so many different levels; What you do not understand about this world ‘may' be for your own safety
A great degree of negligence by parents is rational if strong seeds have been first planted,General,Neutral,Reflective,General,Anytime Wisdom,91,6.8,"Never expect anything from your parents but love; Pets are like children, that is, raise them in negligence and dumb they may be; There is always a GREAT place for you in God's plan"
Not many can handle fame well,General,Neutral,Reflective,General,Anytime Wisdom,29,2.2,"Life in fame is utter damnation to the wise, but if you are smart...; Compare yourself to others only in a noble and just manner - lest you create envy in others; Pay your dues and be kind to other's requests but never depart from moral reason, not necessarily your reason"
In the quest for everlasting love it is a requirement you first know what you are after,Love,Neutral,Reflective,Relationships,Daily Motivation,87,6.5,Believe only those that give all the indication to know better to you; Grow to love your identity; In love only truth is fair
In a world of abnormalities it is best to play it safe,General,Neutral,Reflective,General,Anytime Wisdom,54,4.1,The best people in the world are not full of money but have character; What you do not understand about this world ‘may' be for your own safety; This world would not have happiness without entertainers
Real discovery begins by seeing with new eyes,General,Neutral,Reflective,General,Anytime Wisdom,45,3.4,You can't learn something new from just about anything; The good ones suffer from seeing others in pain; We cannot solve the problems of others if we don't know the ‘real' person
War for power never works,General,Neutral,Advisory,Life Advice,Anytime Wisdom,25,1.9,Never underestimate the power of dreams; Believe in the power of good because there is not much else to rely on; A combination of different artistic works together indicate a story and theme
Respect the good accomplishment of others,General,Neutral,Reflective,General,Anytime Wisdom,41,3.1,"Treating others with respect not always gives you respect so learn to be emotive; Respect education, but remember also to respect hard labour; Respect other's sanctity of being"
"When disclosing shocking news, do so with full awareness",General,Neutral,Reflective,General,Anytime Wisdom,56,4.2,"Some news never make it to the public on the basis of hearsay, this with good cause; It is awareness of the appreciation of the tiniest things in one that builds kinship; To be fully apprised awareness of key media sources is needed"
The simplest of minerals can show great beauty when sculpted right,General,Neutral,Reflective,General,Anytime Wisdom,66,5,"Do the right thing not for deity alone but because it is right; Great nations are inspired by beauty in whatever country; All forms of government work, but to the right people"
Everyone has problems; some just don't know what theirs is yet,General,Neutral,Reflective,General,Daily Motivation,62,4.7,We cannot solve the problems of others if we don't know the ‘real' person; Don't believe everything you read but don't mock just about everything either; If someone gives you something precious of theirs make sure you know their reasons
Hilarity and humour is dehumanizing if done to excess,General,Neutral,Reflective,General,Anytime Wisdom,53,4,Overanalysing is dehumanizing to most; Cheating with humour may be ethical; Thinking of profanity can be dehumanizing
Never expect anything from your parents but love,Love,Neutral,Advisory,Relationships,Anytime Wisdom,48,3.6,Respect your elders and love thy parents no matter what as these are traits of nobility; Grow to love your identity; A great degree of negligence by parents is rational if strong seeds have been first planted
"Celibacy does not entirely define a virgin completely, inclusion of the heart does",General,Neutral,Reflective,General,Anytime Wisdom,82,6.2,Good advertising does not sell everything if the product does not live up to expectations; Arational is he that does not think ahead; How daft does someone have to be to live without purpose?
All people are born leaders; you just have to know your leadership style,General,Neutral,Reflective,Human Nature,Daily Motivation,72,5.4,Servant leadership is amongst the noblest leadership styles; Every genuine artist has his/her own style; Everyone has problems; some just don't know what theirs is yet
Comparing yourself to others is wrong but we all do it at one point,General,Neutral,Reflective,General,Anytime Wisdom,67,5,A side is always in the wrong if one has to utilize spies; In making a passive point sometimes it is good to go straight to the extremes; If anything can go wrong rest assured it shall not always or ever be so
"In the face of two dire unacceptable options, try to think of another way",General,Neutral,Reflective,General,Anytime Wisdom,73,5.5,"If you think your experience is unique, think again, you are only human; Embrace A.I. - think!; In the face of hysteria its best to keep stern"
Getting absolutely drunk is an experience that is not often repeated with wisdom,Wisdom,Neutral,Reflective,Philosophy,Anytime Wisdom,80,6,"If asked to do something foolish while drunk, please think things utterly through first; Good timing means absolutely everything when seeking perfection; Once a lesson is learnt it is not always warranted a mistake shall not be repeated"
Great nations are inspired by beauty in whatever country,General,Neutral,Reflective,General,Anytime Wisdom,56,4.2,The simplest of minerals can show great beauty when sculpted right; Thinking long term all nations ought be potentially united; Nations that unite rapidly certainly have a common nobler cause
Mental conditioning is best done by oneself with reason,General,Neutral,Reflective,General,Anytime Wisdom,55,4.1,Mental conditioning is a process best started young; Learn what reason is; Being honest to oneself does clarify
Treating someone with no dignity in respect can make them ponder,General,Neutral,Reflective,General,Anytime Wisdom,64,4.8,"Treating others with respect not always gives you respect so learn to be emotive; Cling to your dignity otherwise you shall become generic; Respect education, but remember also to respect hard labour"
Trivialities in life can make great conversation pieces,General,Neutral,Reflective,General,Anytime Wisdom,55,4.1,Too much education may make you blind to life itself; Wicked are wars that see human beings as chess pieces; If bored try to make it an objective to make someone happy and see how that feels
The world is strange as no one gets envious if you are last,General,Neutral,Reflective,General,Anytime Wisdom,59,4.4,It is strange how we only see the good in people if they conform to our petty mannerisms; What you do not understand about this world ‘may' be for your own safety; If you raise some beast to be too smart strange things may happen
Love in any form does not necessarily need verbal communication,Love,Neutral,Reflective,Relationships,Anytime Wisdom,63,4.7,"Help others find love that need it so; Things always happen for a reason, not necessarily yours on lesse you will it; Keep in communication with your family because people change fast"
Just because someone doesn't work does not mean they are stupid,General,Neutral,Reflective,Life Advice,Anytime Wisdom,63,4.7,"Just because you may know everything does not mean you can't listen; Pray like you mean it; If you cannot work around the standard times, then make work suit your schedules"
Having older friends is the quickest path to maturity,General,Neutral,Reflective,Human Nature,Anytime Wisdom,53,4,Without friends nothing would ever get done - ultimately...; Learning from history is the quickest way to wisdom; True friends will take a stab for you
The representation of the self is aligned with the surroundings,General,Neutral,Reflective,General,Anytime Wisdom,63,4.7,Only use superstition as a means to inspire positively the self - nothing else; Speak highly of your friends because it reflect your own self ultimately; Hesitating is a common nature in all as an act of self preservation
Great thinkers and doers may even be lazy,General,Neutral,Reflective,General,Anytime Wisdom,41,3.1,Working is just as hard for some people as enjoying a lazy time - whom to pity?; There is always a GREAT place for you in God's plan; Stupid things we do can turn into great tales
Group psychology should never be abused,General,Neutral,Advisory,General,Anytime Wisdom,39,2.9,"Do not let your any secular group bias your entire view of the world without thought; Compare yourself to others only in a noble and just manner - lest you create envy in others; Pay your dues and be kind to other's requests but never depart from moral reason, not necessarily your reason"
Understanding the value of sentience gives us something to fight for,General,Neutral,Reflective,General,Anytime Wisdom,68,5.1,"Higher sentience sometimes is perceived odd; Favouritism will only get you so far but it gives you identity; It is a valuable lesson to ponder deeply about the value of humanity, and what is not"
"When purchasing someone a gift book for someone, be sure you know them well",General,Neutral,Reflective,General,Daily Motivation,75,5.6,If you plan a joke make sure you know the language first; If someone gives you something precious of theirs make sure you know their reasons; Imagination well used may be better than reading a good book
An overflowing wallet only amounts to troubles,General,Neutral,Reflective,General,Anytime Wisdom,46,3.5,"Compare yourself to others only in a noble and just manner - lest you create envy in others; Pay your dues and be kind to other's requests but never depart from moral reason, not necessarily your reason; Never fully trust someone without noble values"
Mankind's capacity to survive establishes them as adaptable - what of the individual?,General,Neutral,Reflective,General,Anytime Wisdom,85,6.4,"Anyone with the capacity to love deserves some respect; Once you survive rock bottom the world looks different; If you survive this lifetime, onto the next, be sure to aide those who suffered previously"
Elegant creatures become renowned through insignias,General,Neutral,Reflective,General,Daily Motivation,51,3.8,"Some creatures never cease to inspire the mind of a thinker; Intelligent creatures, whatever type, are capable of attempting magic - be warned; Compare yourself to others only in a noble and just manner - lest you create envy in others"
It is possible to be mentally fearless but your nerves may not react the same way,Fear,Neutral,Reflective,General,Anytime Wisdom,81,6.1,Believing it is possible takes you most of the way there; If your cause is fair then there is always a way; If time travel is possible it is pre-ordained
Resorting to sweet words for seduction is called cheating,General,Neutral,Reflective,General,Anytime Wisdom,57,4.3,"Cheating with humour may be ethical; There is so much beauty in words and it is words that conquers a nation; Paranoia is useless, it is called being cautious - learn to communicate and it goes away"
Deforming your innate character for the better will add a history of hurt,General,Neutral,Reflective,General,Anytime Wisdom,73,5.5,"Sometimes the mind serves as a better repository of history than paper, so use it; The best people in the world are not full of money but have character; When examining history some things are obvious"
Possessive beeth it whom never let others divulge their thoughts,General,Neutral,Advisory,General,Anytime Wisdom,64,4.8,"Thoughts put forth, even at in an impulse, at times convey much; Learn to ‘let go' when time mandates it so; Never let imagination control your reasoning"
SYLLAS is not an abnormality,General,Neutral,Reflective,General,Anytime Wisdom,28,2.1,"Some people will never understand the meaning of SYLLAS; Compare yourself to others only in a noble and just manner - lest you create envy in others; Pay your dues and be kind to other's requests but never depart from moral reason, not necessarily your reason"
Doing favours when bored solves problems,General,Neutral,Reflective,General,Anytime Wisdom,40,3,Get in the habit of doing some good deeds every once in a while at least - good happens; If someone has been telling you his/her same problems for years then do something; If bored reminiscence on the things you did to pass time when younger
There was no sense in diversity in the past,General,Neutral,Reflective,General,Anytime Wisdom,43,3.2,"Do not completely underestimate the wisdom from the past; Every sinner has a past and every saint a future; There is consensus in natures' beauty, but then diversity necessity intervenes"
When fighting for sheer survival then inner characters get unveiled,General,Neutral,Reflective,General,Anytime Wisdom,67,5,"The inner being may be hard to change, in some cases impossible; If incapable to make a difference project your sheer spirit; The ultimate measure of man stands in the face of sheer evil"
In making a passive point sometimes it is good to go straight to the extremes,General,Neutral,Reflective,General,Anytime Wisdom,77,5.8,Comparing yourself to others is wrong but we all do it at one point; Be careful before making an oath; Food tastes better when passionate emotions are used in the making
"If someone needs a bit of money for a life changing operation, consider charity deeply",General,Neutral,Reflective,General,Anytime Wisdom,86,6.5,Just a little bit of money in the right hands can save lives - start by helping those close; If you at first try and don't succeed consider a different approach; The best people in the world are not full of money but have character
It is not much effort to tidy your bed when staying as guest,General,Neutral,Reflective,General,Anytime Wisdom,60,4.5,"Compare yourself to others only in a noble and just manner - lest you create envy in others; Pay your dues and be kind to other's requests but never depart from moral reason, not necessarily your reason; Never fully trust someone without noble values"
"Eating together on one table, as a family, is a luxury a wide number do not have",General,Neutral,Advisory,General,Anytime Wisdom,80,6,Think deeply at the number of close friends you have and now realise how isolated you are within the context of the whole wide world; Art is now a luxury of which all can afford but still few understand; We can appreciate food better if we know what we are eating
A competitive workplace is hazardous when members differ in skills,General,Neutral,Reflective,Life Advice,Anytime Wisdom,66,5,"Revenge in the workplace can only be accomplished through competency; Everyone's idea of genuine love may differ, but similarities always persist; Allowing music to control your senses and emotions can be hazardous"
Learn to do your research before committing to something,General,Neutral,Reflective,General,Anytime Wisdom,56,4.2,Learn what reason is; You can't learn something new from just about anything; There are perks at every job; you just have to learn how to find them
The hearts of men are swayed by noble ideals,General,Neutral,Reflective,General,Anytime Wisdom,44,3.3,Some noble ideals are worth pursuing but mayhap not throughout all known territory; Certain ideals are admirable by both evil and good alike; Effeminate behaviour in men is an indication of severe hardship
Manipulation of someone is best starting at the primeval point - a suggestive seed,General,Neutral,Reflective,General,Anytime Wisdom,82,6.2,Comparing yourself to others is wrong but we all do it at one point; In making a passive point sometimes it is good to go straight to the extremes; It is best to live with some values than none
Originality is almost always readily noticeable,General,Neutral,Advisory,General,Anytime Wisdom,47,3.5,"Some dreams cannot be readily interpreted without a clear sequel; Plants, even plastic ones, are luxuries readily attainable; The simple pleasures, like flying a kite, or using a bike, can be made readily available"
A genuine philosopher is wise,General,Neutral,Reflective,General,Anytime Wisdom,29,2.2,"Truth is for the wise; Every genuine artist has his/her own style; Life in fame is utter damnation to the wise, but if you are smart..."
